DocID,ProductID,ProductInformation,SolutionSteps,TechnicalTags,DocumentType
DOC001,P1,infoblox ipam  version 8 4 1  nios grid platform,step 1  access the infoblox grid manager web interface with administrative credentials  nstep 2  navigate to data management   dhcp   networks to review current network definitions  nstep 3  export current dhcp scope configurations to identify overlap issues  nstep 4  create reserved ip ranges for static assignments in each network  nstep 5  update dhcp scope boundaries to prevent overlap with static ranges  nstep 6  document all statically assigned addresses in the ip address management system  nstep 7  create ip address allocation policies based on device types and network segments  nstep 8  implement network discovery to identify unauthorized or undocumented ip usage  nstep 9  configure address conflict detection and notification in dhcp servers  nstep 10  validate configuration by testing ip assignment processes in each scope ,"ip-management, dhcp, infoblox, addressing, conflict-resolution",Troubleshooting Guide
DOC002,P2,oracle database 19c enterprise edition  version 19 11 0 0  enterprise database platform,step 1  stop all services accessing the authentication database to prevent further corruption  nstep 2  use rman to identify the extent of database corruption  validate database command   nstep 3  determine most recent valid backup using catalog information  nstep 4  restore database files from backup to staging environment  nstep 5  apply archived redo logs to recover transactions up to the point of corruption  nstep 6  perform database integrity checks using dbverify utility  nstep 7  replace corrupted database files with recovered copies  nstep 8  restart database services and verify authentication functionality  nstep 9  implement enhanced database monitoring with corruption detection capabilities  nstep 10  configure more frequent archive log backups to minimize potential data loss  nstep 11  document recovery procedure for future reference ,"database, oracle, corruption, recovery, authentication",Disaster Recovery Procedure
DOC003,P3,cisco ncs 5500 series  ios xr 7 3 2  carrier grade router,step 1  connect to router using secure administrative access methods  nstep 2  enter configuration mode and review current bgp configuration  nstep 3  identify incorrect as path prepending and community string settings  nstep 4  document current peer relationships and route policy configurations  nstep 5  modify bgp configuration to implement proper route advertisements  nstep 6  configure appropriate maxprefix limits for all bgp peering sessions  nstep 7  implement route dampening to suppress route flapping  nstep 8  apply configuration changes with proper validation  nstep 9  monitor bgp session stability and routing table consistency  nstep 10  document optimal bgp configuration templates for future implementations ,"bgp, routing, cisco, as-path, route-policy, ncs5500",Configuration Guide
DOC004,P4,border gateway protocol  rfc 4271  internet routing protocol,step 1  identify affected bgp peering sessions through monitoring and logs  nstep 2  verify physical and logical connectivity to upstream providers  nstep 3  check bgp session status and routing table entries  nstep 4  coordinate with provider noc to determine nature of backbone issue  nstep 5  implement temporary routing policy changes to prefer alternate providers  nstep 6  configure conditional route advertisements based on path availability  nstep 7  establish bgp multihoming with appropriate path selection attributes  nstep 8  test failover scenarios to validate resilience during provider outages  nstep 9  document bgp peer relationships and expected routing behavior  nstep 10  implement bgp monitoring with alerting for session state changes ,"bgp, routing, isp, multihoming, path-selection",Best Practice Document
DOC005,P5,apache tomcat 9 0 58  java web application server,step 1  identify symptoms of memory leak through application monitoring  nstep 2  capture heap dumps using jmap or similar java diagnostic tools  nstep 3  analyze heap dumps with tools like eclipse mat to identify object retention  nstep 4  review application code focusing on resource handling and object cleanup  nstep 5  implement temporary mitigation by increasing jvm heap allocation  nstep 6  configure proper garbage collection settings appropriate for application workload  nstep 7  apply code fixes for proper object disposal and resource management  nstep 8  implement memory utilization monitoring with trending and alerting  nstep 9  establish baseline memory usage patterns for normal operation  nstep 10  configure jvm restart policies for emergency recovery when leaks are detected ,"memory-leak, java, tomcat, application, heap-analysis",Troubleshooting Guide
DOC006,P6,network time protocol  ntp   rfc 5905  time synchronization service,step 1  identify time synchronization issues through log analysis and system clock verification  nstep 2  document current time sources and ntp hierarchy across network  nstep 3  select authoritative time sources preferably with hardware based time references  nstep 4  configure primary and backup ntp servers with appropriate stratum levels  nstep 5  implement proper ntp authentication using symmetric keys  nstep 6  configure client systems to use multiple time sources with appropriate polling intervals  nstep 7  force immediate time synchronization using ntpdate or equivalent commands  nstep 8  monitor time offset between systems with alerting for excessive variances  nstep 9  document ntp architecture with clear hierarchy and failover paths  nstep 10  establish maximum allowable time skew thresholds appropriate for applications ,"ntp, synchronization, time-services, kerberos, authentication",Configuration Guide
DOC007,P7,veeam backup   replication v11  data protection platform,step 1  document current backup job configuration and dependencies  nstep 2  identify proper startup and shutdown sequence for veeam services  nstep 3  verify database integrity using built in consistency check tools  nstep 4  restore configuration database from known good backup if corruption detected  nstep 5  implement proper maintenance window procedures with validation checkpoints  nstep 6  configure service dependencies to ensure proper startup ordering  nstep 7  test backup job execution and monitoring functionality after maintenance  nstep 8  document recovery time objectives and backup completion windows  nstep 9  create maintenance mode procedure to properly quiesce backup activities  nstep 10  establish verification process for critical system status post maintenance ,"backup, veeam, database, maintenance, recovery",Maintenance Procedure
DOC008,P8,f5 big ip 2000s  tmos 15 1 4  application delivery controller,step 1  review current load balancer configuration including virtual servers and pools  nstep 2  examine health monitoring settings for backend application servers  nstep 3  analyze traffic distribution patterns through statistics interface  nstep 4  adjust health check thresholds to appropriate values for application behavior  nstep 5  configure proper connection persistence based on application requirements  nstep 6  implement application aware health monitoring with content verification  nstep 7  set appropriate load balancing algorithm based on application architecture  nstep 8  configure connection throttling to prevent server overload conditions  nstep 9  implement advanced monitoring for load balancer performance metrics  nstep 10  document optimal configuration for specific application workloads ,"load-balancer, f5, big-ip, application-delivery, health-monitoring",Configuration Guide
DOC009,P9,cisco asr 1001 x  open shortest path first  ospf   rfc 2328  interior gateway protocol,step 1  document current ospf configuration across network infrastructure  nstep 2  identify suboptimal timer settings affecting convergence speed  nstep 3  adjust hello and dead intervals appropriate for network stability requirements  nstep 4  configure ospf areas with proper route summarization boundaries  nstep 5  implement graceful restart features to minimize convergence impact  nstep 6  deploy bidirectional forwarding detection for faster failure detection  nstep 7  configure proper authentication for ospf adjacencies using md5  nstep 8  optimize ospf cost metrics to reflect actual link capabilities  nstep 9  test convergence time with controlled interface shutdown scenarios  nstep 10  document optimal ospf parameter settings for different network segments ,"ospf, routing, convergence, network-design, timer-optimization",Best Practice Document
DOC010,P10,bind 9 16 27  dns server implementation,step 1  verify current zone file configurations and syntax  nstep 2  identify corrupted or improperly formatted zone entries  nstep 3  restore zone files from known good backups where available  nstep 4  implement zone file syntax validation before deployment  nstep 5  configure proper zone transfer security using tsig authentication  nstep 6  implement dnssec for critical domains with appropriate key management  nstep 7  configure monitoring for dns query performance and resolution success rates  nstep 8  establish proper dns hierarchy with clear primary and secondary server roles  nstep 9  implement split horizon dns where appropriate for security  nstep 10  document dns architecture with zone responsibilities and update procedures ,"dns, bind, resolution, zone-management, dnssec",Configuration Guide
DOC011,P11,microsoft windows server 2019  dns server role,step 1  identify impacted dns servers through client resolution testing  nstep 2  review dns event logs for error messages and corruption indicators  nstep 3  verify zone data integrity using dns management console  nstep 4  restore affected zones from active directory replication or backup  nstep 5  implement dns security features including response rate limiting  nstep 6  configure proper forwarding and delegation relationships  nstep 7  optimize zone transfer settings for appropriate replication frequency  nstep 8  implement dns analytics and monitoring for query pattern analysis  nstep 9  configure dns policies for intelligent client steering where appropriate  nstep 10  document windows dns deployment with security best practices ,"dns, windows-server, active-directory, zone-transfer, microsoft",Troubleshooting Guide
DOC012,P12,cisco protocol independent multicast  pim  routing  rfc 7761  multicast routing protocol,step 1  document current multicast implementation including source and group addresses  nstep 2  verify pim configuration on all routers in the multicast path  nstep 3  identify rendezvous point  rp  assignment methodology and current configuration  nstep 4  implement anycast rp for improved redundancy where appropriate  nstep 5  configure multicast boundaries to control scope of traffic propagation  nstep 6  optimize pim timers for appropriate convergence requirements  nstep 7  implement ssm  source specific multicast  for known sources  nstep 8  configure multicast qos to ensure proper treatment of stream traffic  nstep 9  deploy multicast monitoring tools with specific focus on packet loss metrics  nstep 10  document optimal multicast design with clear rp assignment strategy ,"multicast, pim, routing, streaming, rendezvous-point",Configuration Guide
DOC013,P13,cisco identity services engine v3 1  network access control platform,step 1  identify indicators of compromise through security monitoring logs  nstep 2  isolate affected systems through dynamic vlan assignment  nstep 3  implement emergency network segmentation to contain lateral movement  nstep 4  capture network traffic for forensic analysis and attack vector identification  nstep 5  deploy updated security signatures to endpoint protection platforms  nstep 6  enhance network segmentation with proper access control enforcement  nstep 7  implement enhanced authentication requirements for sensitive systems  nstep 8  deploy behavior based anomaly detection for early warning of suspicious activity  nstep 9  conduct security awareness training focusing on attack prevention  nstep 10  document incident response procedure for similar security events ,"security, malware, cisco, ise, network-access-control",Incident Response Procedure
DOC014,P14,digicert certificate management  public key infrastructure,step 1  identify all ssl certificates in the environment through network scanning  nstep 2  document certificate attributes including issuance date  expiration  and key length  nstep 3  implement centralized certificate management platform with inventory capabilities  nstep 4  configure automated expiration notifications with appropriate lead time  nstep 5  establish multiple notification recipients to prevent single points of failure  nstep 6  implement automated certificate renewal where supported by certificate authority  nstep 7  create certificate ownership matrix with role based assignments  nstep 8  configure monitoring for certificate validity and expiration status  nstep 9  establish emergency certificate renewal procedure for critical services  nstep 10  document certificate deployment procedures specific to different services ,"certificate, ssl, security, pki, digicert",Best Practice Document
DOC015,P15,cisco asr 9922  ios xr 7 5 2  core router platform,step 1  connect to router console port using appropriate terminal settings  nstep 2  perform hardware diagnostics using admin diagnostic commands  nstep 3  identify failed components through led indicators and diagnostic output  nstep 4  properly power down affected equipment following safety procedures  nstep 5  replace faulty power supply module according to vendor instructions  nstep 6  verify proper seating and connection of all replaceable components  nstep 7  power up router following appropriate sequence for chassis type  nstep 8  verify hardware status through show platform and show environment commands  nstep 9  confirm normal operation of routing protocols and interface status  nstep 10  implement enhanced monitoring for power system health metrics ,"router, cisco, hardware, power-supply, asr9000",Hardware Replacement Guide
DOC016,P16,microsoft active directory domain services  windows server 2022,step 1  identify symptoms of database corruption through authentication failure patterns  nstep 2  boot affected domain controller into directory services restore mode  dsrm   nstep 3  run semantic database analysis using ntdsutil to identify corruption extent  nstep 4  perform authoritative restoration from backup using appropriate commands  nstep 5  force replication to all secondary domain controllers in the environment  nstep 6  verify kerberos ticket granting service operation through testing  nstep 7  reset machine account passwords for affected systems if necessary  nstep 8  implement enhanced monitoring for authentication success rates  nstep 9  configure database consistency checking on regular intervals  nstep 10  document recovery procedures specific to environment architecture ,"active-directory, microsoft, authentication, database, ntds",Disaster Recovery Procedure
DOC017,P17,cisco isr 4451  internet protocol version 6  ipv6   rfc 8200  network layer protocol,step 1  identify ipv6 connectivity issues through end to end path testing  nstep 2  verify icmpv6 filtering policies on security devices in the path  nstep 3  configure appropriate permissions for essential icmpv6 message types  nstep 4  optimize path mtu discovery settings on routers and endpoints  nstep 5  implement proper ipv6 security controls without blocking required functionality  nstep 6  configure dual stack monitoring with specific focus on ipv6 metrics  nstep 7  establish appropriate ipv6 address allocation methodology for environment  nstep 8  implement transition mechanisms where required for legacy compatibility  nstep 9  deploy ipv6 specific security monitoring with appropriate alerting  nstep 10  document comprehensive ipv6 architecture and security standards ,"ipv6, networking, security, pmtud, icmpv6",Best Practice Document
DOC018,P18,cisco nexus 93180yc fx  nx os 9 3 8   data center switch,step 1  access switch management interface and review current vlan configuration  nstep 2  document existing vlan assignments and trunking configuration  nstep 3  identify overlapping or inconsistent vlan definitions across the network  nstep 4  create standardized vlan design with clear segmentation boundaries  nstep 5  implement configuration changes with proper change control procedures  nstep 6  verify vlan propagation through spanning tree domain  nstep 7  test inter vlan routing functionality after configuration changes  nstep 8  deploy configuration management system for network devices  nstep 9  establish standard vlan naming and numbering convention  nstep 10  document updated vlan architecture with purpose and scope definitions ,"vlan, cisco, nexus, configuration, datacenter",Configuration Guide
DOC019,P19,cisco nexus 93180yc ex  nx os 9 3 7   top of rack switch,step 1  connect to switch console port using appropriate terminal settings  nstep 2  run hardware diagnostics to identify specific component failures  nstep 3  properly power down affected switch following safety procedures  nstep 4  replace fabric modules according to vendor documentation  nstep 5  verify proper seating of all replaceable components  nstep 6  power up switch following recommended sequence  nstep 7  load configuration from backup or management system  nstep 8  verify interface status and protocol operation  nstep 9  re establish connectivity to affected servers and network segments  nstep 10  implement enhanced monitoring for switch fabric health ,"switch, datacenter, cisco, hardware, nexus",Hardware Replacement Guide
DOC020,P20,cisco catalyst 9600 series  link aggregation control protocol  lacp   ieee 802 3ad  link bundling protocol,step 1  document current link aggregation configuration across all participating devices  nstep 2  identify inconsistencies in lacp negotiation parameters between devices  nstep 3  standardize lacp settings including system priority and port priority values  nstep 4  configure consistent mode settings  active passive  on all participating ports  nstep 5  implement appropriate load distribution algorithm based on traffic patterns  nstep 6  verify proper negotiation and bundle formation through show commands  nstep 7  test traffic distribution across aggregated links using appropriate tools  nstep 8  implement link state monitoring with appropriate alerting thresholds  nstep 9  document standard operating procedure for lacp implementation  nstep 10  create troubleshooting guide for link aggregation issues ,"lacp, link-aggregation, redundancy, ethernet, networking",Configuration Guide
DOC021,P21,cisco catalyst 9300  ios xe 17 6 3  access switch,step 1  identify specific firmware version causing compatibility issues  nstep 2  verify current firmware version on affected switches  nstep 3  download appropriate previous stable firmware version  nstep 4  establish console access to affected switches for recovery  nstep 5  perform emergency firmware downgrade following vendor procedures  nstep 6  verify proper operation of poe controller after downgrade  nstep 7  test power delivery to connected devices across various power classes  nstep 8  develop phased upgrade plan with extended testing in lab environment  nstep 9  document firmware compatibility matrix for switch models  nstep 10  implement change management procedures for firmware updates ,"firmware, switch, cisco, catalyst, poe",Firmware Management Guide
DOC022,P22,cisco catalyst 9500  ios xe 17 9 2  core switch,step 1  identify firmware incompatibility symptoms through device logs and behavior  nstep 2  establish console access to affected devices for management  nstep 3  determine compatible firmware version through vendor documentation  nstep 4  download appropriate firmware files to accessible tftp scp server  nstep 5  perform controlled downgrade procedure following vendor guidelines  nstep 6  verify proper device operation after firmware change  nstep 7  test management platform integration with adjusted firmware  nstep 8  create compatibility matrix documenting tested version combinations  nstep 9  implement pre deployment testing protocol for firmware updates  nstep 10  document firmware validation procedure for production deployment ,"firmware, management, cisco, compatibility, catalyst",Troubleshooting Guide
DOC023,P23,cisco quality of service  qos   diffserv architecture  traffic management,step 1  document current qos configuration across network infrastructure  nstep 2  identify traffic classification and marking methodology in use  nstep 3  verify queuing strategies appropriate for different traffic types  nstep 4  configure proper priority queuing for real time application traffic  nstep 5  implement appropriate bandwidth reservation for critical applications  nstep 6  configure traffic shaping and policing where appropriate  nstep 7  optimize buffer allocation for different queue types based on traffic characteristics  nstep 8  verify end to end qos behavior through testing and monitoring  nstep 9  implement enhanced monitoring for application quality metrics  nstep 10  create qos design document with standard configurations ,"qos, voice, traffic-management, differentiated-services, prioritization",Best Practice Document
DOC024,P24,cisco firepower threat defense 7 0 1  next generation firewall,step 1  document current firewall policy configuration and deployment methodology  nstep 2  identify ci cd pipeline components responsible for policy deployment  nstep 3  analyze syntax errors in automated configuration templates  nstep 4  implement proper error handling in configuration parsing scripts  nstep 5  develop enhanced validation checks for firewall rule consistency  nstep 6  create testing methodology for configuration changes before deployment  nstep 7  implement staged deployment approach for policy changes  nstep 8  configure audit logging for all configuration changes with user attribution  nstep 9  establish formal change management procedures for security policies  nstep 10  document best practices for automated security policy deployment ,"firewall, cisco, automation, configuration, ci-cd",Configuration Guide
DOC025,P25,spanning tree protocol  stp   ieee 802 1d w s  loop prevention protocol,step 1  document current spanning tree topology including root bridge assignment  nstep 2  identify unauthorized equipment causing bridging loops  nstep 3  implement bpdu guard on all access ports to prevent unauthorized bridges  nstep 4  configure root guard on appropriate ports to maintain topology stability  nstep 5  optimize stp timers appropriate for network size and convergence requirements  nstep 6  implement modern stp variants  rstp mst  where supported for faster convergence  nstep 7  configure storm control on all edge ports with appropriate thresholds  nstep 8  establish clear root bridge election strategy with primary and backup devices  nstep 9  implement network access control to prevent unauthorized devices  nstep 10  document spanning tree design with topology diagrams and expected behavior ,"spanning-tree, switch, network-loop, ethernet, stp",Best Practice Document
DOC026,P26,cisco unified communications manager 14 0  voice platform,step 1  identify sip trunk registration failures through detailed logs  nstep 2  capture sip signaling traffic using appropriate packet capture tools  nstep 3  analyze authentication failures in sip messages  nstep 4  contact sip trunk provider to verify authentication requirements  nstep 5  update sip trunk configuration with renewed credentials  nstep 6  implement certificate based authentication with proper expiration handling  nstep 7  configure sip trunk monitoring with registration status alerting  nstep 8  establish automated testing of call completion through trunk  nstep 9  document sip trunk configuration standards for the environment  nstep 10  create certificate lifecycle management procedure for voice services ,"voice, sip, cisco, unified-communications, trunk",Troubleshooting Guide
DOC027,P27,juniper mx960  junos 21 2r3 s1  core router,step 1  connect to router console to access device not responding to management protocols  nstep 2  examine hardware status through cli diagnostic commands  nstep 3  identify fabric card failure through component status indicators  nstep 4  properly power down affected components following safety guidelines  nstep 5  replace failed fabric module according to vendor documentation  nstep 6  verify proper seating and connection of replacement components  nstep 7  perform power up sequence according to recommended procedures  nstep 8  verify system status through appropriate diagnostic commands  nstep 9  confirm protocol and interface operation after component replacement  nstep 10  implement enhanced telemetry specific to fabric health monitoring ,"router, juniper, hardware, fabric, mx960",Hardware Replacement Guide
