DocID,ProductID,ProductInformation,SolutionSteps,TechnicalTags,DocumentType
DOC028,P28,cisco identity services engine 3 1  network access control,step 1  verify database replication status between ise nodes in deployment  nstep 2  identify synchronization issues through detailed logging  nstep 3  correct database replication configuration where errors are found  nstep 4  force full replication between nodes to establish consistency  nstep 5  restart ise services in the proper sequence per vendor guidelines  nstep 6  verify authentication policy synchronization across deployment  nstep 7  test device authentication using various credentials and device types  nstep 8  configure enhanced monitoring for replication status with alerting  nstep 9  document ise deployment architecture with replication flows  nstep 10  create troubleshooting runbook for authentication failures ,"nac, authentication, cisco, database, replication",Troubleshooting Guide
DOC029,P29,palo alto pa 5250  pan os 10 1 6 h6  next generation firewall,step 1  identify ddos attack characteristics through traffic analysis  nstep 2  configure traffic classification to identify attack patterns  nstep 3  implement temporary filtering rules to mitigate immediate impact  nstep 4  engage ddos mitigation service for traffic scrubbing capabilities  nstep 5  configure bgp routing changes to direct traffic through scrubbing centers  nstep 6  implement geographic based access controls to block attack sources  nstep 7  deploy custom application signatures based on observed attack patterns  nstep 8  configure dos protection profiles with appropriate thresholds  nstep 9  implement zone protection profiles with connection rate limiting  nstep 10  document ddos response playbook for future incidents ,"security, ddos, firewall, palo-alto, mitigation",Incident Response Procedure
DOC030,P30,palo alto pa 3260  pan os 10 2 2 h3  next generation firewall,step 1  identify false positive patterns through security log analysis  nstep 2  verify legitimate traffic being incorrectly blocked through packet capture  nstep 3  create application override rules for affected traffic patterns  nstep 4  implement security policy exceptions with appropriate documentation  nstep 5  configure custom application signatures when needed for proper identification  nstep 6  coordinate with security vendor for signature optimization  nstep 7  establish pre production testing environment for signature updates  nstep 8  implement phased deployment approach for security content updates  nstep 9  configure enhanced logging for policy matches to identify future issues  nstep 10  document exception handling process for security policies ,"ips, security, palo-alto, signature, false-positive",Troubleshooting Guide
DOC031,P31,cisco anyconnect secure mobility client v4 10 05095  vpn client,step 1  identify certificate expiration issues through vpn connection logs  nstep 2  verify certificate status on vpn concentrators and endpoints  nstep 3  generate new certificates with appropriate validity period  nstep 4  deploy updated certificates to vpn infrastructure  nstep 5  test vpn connectivity from multiple client locations and device types  nstep 6  implement certificate lifecycle management system for automation  nstep 7  configure multiple notification paths for certificate expiration warnings  nstep 8  create tiered alerting for 30  15  and 5 days before expiration  nstep 9  document certificate renewal procedures with responsible parties  nstep 10  establish monitoring for vpn tunnel establishment success rates ,"vpn, remote-access, cisco, certificate, anyconnect",Best Practice Document
DOC032,P32,f5 big ip i4800  tmos 16 1 0  application delivery controller,step 1  analyze current load distribution patterns through statistics interface  nstep 2  identify algorithm configuration errors causing uneven distribution  nstep 3  document application requirements for session persistence and stickiness  nstep 4  configure appropriate load balancing algorithm for application characteristics  nstep 5  optimize health check parameters to accurately reflect server status  nstep 6  implement appropriate server weighting based on capacity metrics  nstep 7  configure enhanced monitoring for server load and response time  nstep 8  establish alerting for uneven load distribution patterns  nstep 9  document optimal load balancer configuration for different application types  nstep 10  create load balancer management procedures with testing methodology ,"load-balancer, algorithm, f5, big-ip, traffic-distribution",Configuration Guide
DOC033,P33,bluecoat proxysg s500 20  sgos 6 7 4 1  web proxy,step 1  identify capacity constraints through proxy performance metrics  nstep 2  analyze traffic patterns to determine growth trends and peak usage  nstep 3  optimize proxy caching parameters for improved efficiency  nstep 4  implement content categorization to apply appropriate policies by traffic type  nstep 5  configure traffic shaping policies for bandwidth management  nstep 6  deploy additional proxy instances in load balanced configuration  nstep 7  implement bypass mechanisms for uncacheable or trusted traffic  nstep 8  establish capacity planning process integrated with growth projections  nstep 9  configure enhanced monitoring with predictive analysis capabilities  nstep 10  document proxy architecture with scalability considerations ,"capacity, proxy, bluecoat, internet, caching",Best Practice Document
DOC034,P34,equinix cloud exchange fabric  cloud interconnect service,step 1  identify connectivity issues through end to end testing to cloud resources  nstep 2  engage equinix support to troubleshoot backbone router issues  nstep 3  implement failover to secondary connections through alternate exchange points  nstep 4  configure bgp routing to prefer available paths during outage  nstep 5  establish emergency vpn tunnels for critical application access if needed  nstep 6  monitor service restoration progress with provider  nstep 7  enhance monitoring for cross connect health with automated testing  nstep 8  implement geographic diversity for critical cloud connections  nstep 9  document cloud connectivity architecture with redundancy considerations  nstep 10  create incident response playbook for similar service disruptions ,"cloud, vendor, connectivity, equinix, exchange",Disaster Recovery Procedure
DOC035,P35,cisco asr 1006 x  mpls traffic engineering  rfc 3209  traffic management protocol,step 1  document current mpls te implementation including tunnel definitions  nstep 2  identify rsvp signaling failures through detailed logging  nstep 3  verify resource reservation configuration on all path routers  nstep 4  correct reservation parameters to appropriate values for traffic requirements  nstep 5  optimize explicit path definitions for critical traffic flows  nstep 6  implement appropriate rsvp authentication mechanisms for security  nstep 7  configure automatic bandwidth adjustment where appropriate  nstep 8  test tunnel establishment and path selection with monitoring  nstep 9  verify qos policy application to engineered tunnels  nstep 10  document traffic engineering design with capacity planning considerations ,"traffic-engineering, mpls, rsvp, qos, tunnel",Configuration Guide
DOC036,P36,dell emc powerstore 1000t  storage controller v2 5 0 0 5 126  san storage,step 1  identify storage connectivity issues through host i o error analysis  nstep 2  run diagnostic tools to evaluate controller health and status  nstep 3  engage vendor support with diagnostic data for troubleshooting assistance  nstep 4  prepare replacement controller hardware according to vendor instructions  nstep 5  follow proper procedures for controller replacement in production environment  nstep 6  update firmware to recommended version during replacement process  nstep 7  restore multipathing configuration for all connected hosts  nstep 8  verify storage access and performance from all hosts after replacement  nstep 9  rebalance workloads across available resources for optimal performance  nstep 10  implement enhanced storage path monitoring with automated failover testing ,"storage, san, dell-emc, controller, replacement",Hardware Replacement Guide
DOC037,P37,hp enterprise 5412r zl2 switch  arubaos 16 10 0011  core switch,step 1  assess physical damage to networking equipment after power event  nstep 2  test power distribution units and surge protectors for functionality  nstep 3  replace damaged power protection devices with higher joule rating models  nstep 4  implement power conditioning equipment appropriate for environment  nstep 5  perform controlled equipment restart in proper sequence  nstep 6  test each module and line card for proper operation  nstep 7  replace damaged components identified during testing  nstep 8  verify network connectivity across all affected segments  nstep 9  apply firmware updates to address known power handling vulnerabilities  nstep 10  implement enhanced power monitoring and protection systems ,"power, infrastructure, surge, switch, hpe",Disaster Recovery Procedure
DOC038,P38,cisco asr 1002 hx  multi protocol label switching  mpls   rfc 3031  wan technology,step 1  identify mpls service disruption through path analysis tools  nstep 2  verify ce router configuration and interface status to provider network  nstep 3  engage mpls provider support with detailed problem description  nstep 4  implement backup connectivity through alternative means where available  nstep 5  configure dynamic multipoint vpn as backup where feasible  nstep 6  test failover capabilities between primary and backup connections  nstep 7  monitor provider troubleshooting and service restoration  nstep 8  verify end to end connectivity as provider resolves control plane issues  nstep 9  document wan architecture with proper redundancy considerations  nstep 10  implement enhanced path monitoring with performance metrics ,"mpls, wan, connectivity, service-provider, backup",Troubleshooting Guide
DOC039,P39,commscope category 6a cabling  tia 568 2 d compliance  infrastructure,step 1  identify extent of cable damage through visual inspection and testing  nstep 2  document affected cable runs with specific locations and identifiers  nstep 3  establish priority restoration plan based on business impact assessment  nstep 4  deploy temporary patch cables for critical connections where possible  nstep 5  coordinate proper access to cable pathways with facilities management  nstep 6  install new cable runs following proper installation practices  nstep 7  terminate cables according to industry standards with appropriate connectors  nstep 8  test new cable installations with certification equipment  nstep 9  update cable plant documentation with new installations  nstep 10  implement enhanced physical infrastructure protection measures ,"cable, physical, infrastructure, cabling, installation",Installation Guide
DOC040,P40,cisco asa 5555 x  asa os 9 16 2  firewall,step 1  identify management access issues through connection testing  nstep 2  establish console connection to firewall for emergency access  nstep 3  review recent security policy changes in configuration  nstep 4  identify specific acl entries blocking legitimate administrative access  nstep 5  modify access control lists to allow proper management connectivity  nstep 6  implement change control procedures for security rule modifications  nstep 7  establish out of band management network for critical infrastructure  nstep 8  configure management access restrictions with appropriate security  nstep 9  document proper acl syntax for commonly used access scenarios  nstep 10  create emergency access procedure for similar incidents ,"management, access, cisco, firewall, asa",Troubleshooting Guide
DOC041,P41,fiber optic cross connects  single mode fiber infrastructure,step 1  identify connectivity issues between redundant fiber paths  nstep 2  perform physical path diversity verification through documentation review  nstep 3  conduct fiber trace to identify actual physical routing of cables  nstep 4  implement truly diverse physical paths with proper separation  nstep 5  verify optical power levels on all connections meet specifications  nstep 6  test failover capability between redundant connections  nstep 7  update physical infrastructure documentation with accurate pathways  nstep 8  implement physical path diversity verification procedures  nstep 9  deploy fiber monitoring systems for early detection of degradation  nstep 10  create redundancy testing protocols for periodic validation ,"redundancy, fiber, datacenter, connectivity, physical-diversity",Best Practice Document
DOC042,P42,juniper mx204  junos 20 4r3 s1  edge router,step 1  verify circuit outage through interface diagnostics and carrier coordination  nstep 2  implement emergency dmvpn over lte for temporary connectivity  nstep 3  configure appropriate routing to utilize backup paths  nstep 4  coordinate with fiber repair crews to expedite resolution  nstep 5  test connectivity through alternative paths to ensure business continuity  nstep 6  monitor repair progress through regular updates from provider  nstep 7  verify circuit restoration through interface diagnostics  nstep 8  return traffic to primary paths once stability is confirmed  nstep 9  document incident timeline for sla and contract enforcement  nstep 10  implement enhanced circuit monitoring with automated failover testing ,"fiber, wan, connectivity, juniper, backup",Disaster Recovery Procedure
DOC043,P43,cummins power generation 1000dqfad  emergency generator,step 1  verify generator failure through visual inspection and control panel diagnostics  nstep 2  identify specific transfer switch and control circuit components causing failure  nstep 3  implement manual bypass procedure to establish temporary generator connection  nstep 4  replace failed components according to manufacturer guidelines  nstep 5  test automatic transfer functionality with simulated power loss  nstep 6  verify proper power delivery to all critical infrastructure  nstep 7  implement weekly generator testing schedule with load testing  nstep 8  configure enhanced alerting for generator system status and fuel levels  nstep 9  install redundant transfer switch control circuits for improved reliability  nstep 10  document emergency power procedures with manual intervention steps ,"power, generator, datacenter, transfer-switch, backup",Maintenance Procedure
DOC044,P44,vertiv liebert apm 150kva ups  data center power infrastructure,step 1  assess extent of flooding damage to data center infrastructure  nstep 2  implement disaster recovery procedures following established playbook  nstep 3  coordinate migration of critical services to secondary data center  nstep 4  deploy emergency water extraction equipment once safe access is established  nstep 5  perform detailed damage assessment of electrical and mechanical systems  nstep 6  engage specialized hvac and electrical contractors for repairs  nstep 7  deploy temporary power and cooling equipment as needed  nstep 8  perform staged restoration of systems following recovery plan  nstep 9  test all restored systems for proper operation before returning to production  nstep 10  implement enhanced flood protection measures for future events ,"disaster, power, datacenter, environmental, flooding",Disaster Recovery Procedure
DOC045,P45,solarwinds npm 2023 1  network monitoring platform,step 1  identify monitoring system performance issues through log analysis  nstep 2  examine database size and growth trends over time  nstep 3  allocate additional compute and memory resources to database server  nstep 4  implement database optimization procedures including index maintenance  nstep 5  archive historical data to reduce active dataset size  nstep 6  configure appropriate data retention policies for different metric types  nstep 7  optimize database queries through execution plan analysis  nstep 8  implement database maintenance jobs for regular optimization  nstep 9  configure alert processing thresholds appropriate for environment size  nstep 10  create performance baseline and trending for capacity planning ,"monitoring, database, solarwinds, alerts, performance",Troubleshooting Guide
DOC046,P46,cisco 9800 wireless controller  ios xe 17 7 1  wifi infrastructure,step 1  identify controller failure symptoms through client connectivity testing  nstep 2  establish console access to controllers for diagnostic information  nstep 3  capture system logs and error messages for analysis  nstep 4  coordinate with vendor support to identify software defect  nstep 5  restore clean configuration from backup to controller units  nstep 6  apply vendor recommended patches for identified issues  nstep 7  configure controllers with proper high availability settings  nstep 8  verify wireless service restoration across all access points  nstep 9  implement enhanced monitoring for wireless infrastructure  nstep 10  create redundancy strategy preventing common mode failures ,"wireless, controller, cisco, wifi, high-availability",Troubleshooting Guide
DOC047,P47,vmware nsx t 3 2  software defined networking platform,step 1  identify controller cluster health issues through management interface  nstep 2  determine cluster quorum status and synchronization state  nstep 3  isolate non primary controllers from making configuration changes  nstep 4  establish single authoritative controller for configuration  nstep 5  back up current network state and configuration data  nstep 6  restore controller cluster to consistent software version  nstep 7  reconfigure cluster quorum settings to prevent split brain condition  nstep 8  push consistent network configuration from primary controller  nstep 9  verify network forwarding behavior through comprehensive testing  nstep 10  document controller cluster recovery procedures for future incidents ,"sdn, controller, vmware, nsx, virtualization",Disaster Recovery Procedure
DOC048,P48,schneider electric netbotz 750  environmental monitoring system,step 1  identify cooling system failure through temperature monitoring alerts  nstep 2  deploy portable cooling units to critical equipment rows for immediate mitigation  nstep 3  engage hvac specialists to diagnose specific cooling unit failures  nstep 4  replace failed cooling controller and sensor components as needed  nstep 5  recharge refrigerant system to proper levels following specifications  nstep 6  recalibrate temperature and humidity sensors throughout facility  nstep 7  implement phased restart of equipment once temperatures stabilize  nstep 8  optimize airflow management for improved cooling efficiency  nstep 9  install additional temperature sensors at key monitoring points  nstep 10  update environmental monitoring thresholds and alerting configuration ,"cooling, datacenter, environmental, temperature, monitoring",Troubleshooting Guide
DOC049,P49,apc symmetra px 80kw  ups system with network management card,step 1  identify power quality issues through ups monitoring and logs  nstep 2  perform power quality analysis using specialized measurement equipment  nstep 3  document harmonic distortion and voltage fluctuation patterns  nstep 4  install appropriate power conditioning equipment based on analysis  nstep 5  reconfigure ups systems for enhanced filtering capabilities  nstep 6  implement staged power distribution to critical systems  nstep 7  coordinate with local utility provider on underlying power issues  nstep 8  configure enhanced power monitoring with waveform capture  nstep 9  establish appropriate alarm thresholds for early warning of issues  nstep 10  document power protection architecture with redundancy considerations ,"power, infrastructure, ups, distribution, power-quality",Best Practice Document
DOC050,P50,ciena 6500  r9 0  optical transport platform,step 1  identify optical signal degradation through power level monitoring  nstep 2  utilize otdr testing to locate specific damage points in fiber path  nstep 3  coordinate with facilities for access to cable pathways and conduits  nstep 4  deploy fiber technicians with appropriate splicing and testing equipment  nstep 5  replace damaged fiber sections following industry best practices  nstep 6  verify optical power levels meet manufacturer specifications  nstep 7  implement fiber plant monitoring system with early warning capabilities  nstep 8  configure automatic notification of signal degradation below thresholds  nstep 9  document updated fiber plant layout with test results and specifications  nstep 10  establish regular preventative maintenance schedule for fiber infrastructure ,"fiber, datacenter, optical, ciena, connectivity",Maintenance Procedure
